id,nome,descricao,dt_inicio,dt_conclusao,responsavel_id,custo,observacoes,status
1,Desenvolvimento de Sistema de Gestão,Sistema para gerenciar operações internas da empresa.,2024-01-10,2024-04-15,1,15000.0,Projeto prioritário para o primeiro semestre.,Concluído
2,Implementação de CRM,Sistema de gestão de relacionamento com o cliente.,2024-05-01,2024-09-20,3,22000.0,Necessidade de integração com o sistema legado.,Em Execução
3,Desenvolvimento de Aplicativo Móvel,Aplicativo móvel para clientes acessarem seus dados.,2024-06-15,,5,18000.0,"Em fase inicial, definição de requisitos.",Em Planejamento
4,Reestruturação do Site Institucional,Redesign do site corporativo da empresa.,2024-03-10,2024-06-05,2,8000.0,Redesign completo com SEO otimizado.,Concluído
5,Migração para Nuvem,Migração de servidores e banco de dados para a nuvem.,2024-02-01,2024-12-15,7,50000.0,Expectativa de reduzir custos de infraestrutura.,Em Execução
6,Treinamento de Equipe,Programa de capacitação para os colaboradores.,2024-04-20,2024-07-25,4,12000.0,Treinamento em novas ferramentas de gestão.,Concluído
7,Projeto de Sustentabilidade,Implementação de práticas de sustentabilidade.,2024-08-01,,10,25000.0,Atividade contínua sem prazo definido.,Em Planejamento
